Index,Video Url,Video Title,Video Views,Video Likes,Video Comments,Video Author,Duration In Seconds
183,https://www.youtube.com/watch?v=ewBJ8uw0si4,I Love Technology,2758427,128778,7171,penguinz0,535
184,https://www.youtube.com/watch?v=CBnr4wFpi-s,'Bloomberg Technology' Full Show (03/17/2023),12430,144,9,Bloomberg Technology,2659
185,https://www.youtube.com/watch?v=syB1ezRvKpU,I bought the SMALLEST Tech in the world.,22441177,495850,20363,Mrwhosetheboss,1340
186,https://www.youtube.com/watch?v=U0YW7x9U5TQ,Electric cars prove we need to rethink brake lights,2822381,123634,16341,Technology Connections,1783
187,https://www.youtube.com/watch?v=S3Qz3HapNh0,China Just LAUNCHED Its Artificial Sun To Show It's TECHNOLOGICAL POWER!,470081,4308,715,Voyager,1014
188,https://www.youtube.com/watch?v=DENG7Q7VRgo,Past and Present | Technology Then and Now,1142463,7214,367,Astrolabe,309
189,https://www.youtube.com/watch?v=jDSKfWB1dEM,7 Majedaar IPL Tech !,5259893,272849,10384,Tech Burner,472
190,https://www.youtube.com/watch?v=yJKMBlQDjDc,Sneak Peek at the Tech Inside the $2.3B MSG Sphere,88312,1226,55,CNET,293
191,https://www.youtube.com/watch?v=5guiUrgcblM,The Danger of AI | Scary Technology | Artificial Intelligence | Documentary,620580,5800,657,Moconomy,3121
192,https://www.youtube.com/watch?v=xgcRdRj9YTU,Banking Crisis | Bloomberg Technology 03/14/2023,23317,195,19,Bloomberg Technology,2653
193,https://www.youtube.com/watch?v=ZDzjqmU43Vw,How Has Technology Made Our Lives Easier?,16298,235,10,Explified,250
194,https://www.youtube.com/watch?v=-pWBbQuIcuI,Live Lessons for IELTS Speaking Practice: Topic of Technology PART 2,73419,2297,111,English Speaking Success,4812
195,https://www.youtube.com/watch?v=t8Cziqv2pb8,Most Insane Military Technologies And Vehicles In The World,1614630,13184,300,The Fancy Banana,1690
196,https://www.youtube.com/watch?v=3DdUvoc7tJ4,How do vinyl records hold stereo sound?,779050,38834,2557,Technology Connections,1056
197,https://www.youtube.com/watch?v=_AXKPrw2efw,New Car Technology We Really Love [Doug DeMuro + Alanis King],148363,5956,1165,Doug DeMuro,1329
198,https://www.youtube.com/watch?v=Tr3O2HgD3BI,TikTok Fallout | Bloomberg Technology 03/24/2023,9844,120,35,Bloomberg Technology,2656
199,https://www.youtube.com/watch?v=8k89c2iSU60,Impressive 3D Printing Technology at FORMNEXT 2022,522957,16793,494,CNC Kitchen,704
200,https://www.youtube.com/watch?v=JoTtD3ZSueU,7 Ancient Technologies Far Too Advanced For Their Time,8958538,97121,3107,WATOP,581
201,https://www.youtube.com/watch?v=rTawvzH0MQ4,"Toyota CEO: ""This New Engine Will Destroy The Entire EV Industry!""",13037347,115652,15065,Car Maniacs,495
202,https://www.youtube.com/watch?v=a9SmPL-ADJU,"Cooking chicken wing, eating in jungle | Primitive technology",718761,6927,283,Primitive Wildlife.,766
203,https://www.youtube.com/watch?v=M-g6mDCPY5Y,Skoda's New Futuristic Interior Tech,3149007,31261,2336,Supercar Blondie,653
204,https://www.youtube.com/watch?v=fdl8jucPlf4,Top 5 Best Tech Gadgets Under Rs.1000⚡May 2023,376961,19350,567,Trakin Tech,404
205,https://www.youtube.com/watch?v=1ZKkvuuzG98,Bloomberg Technology 08/21/2023,8999,146,11,Bloomberg Technology,2668
206,https://www.youtube.com/watch?v=-sR4cSgQo3k,'Bloomberg Technology' Full Show (05/08/2023),12341,122,16,Bloomberg Technology,2661
207,https://www.youtube.com/watch?v=_TsonN7YIdA,20 Emerging Technologies That Will Change Our World,3695891,14923,110,Future Unity,1631
208,https://www.youtube.com/watch?v=JEIHogpVJ1k,Technology Song for Kids - The Polkadots,1158550,3465,0,polkadotsnz,133
209,https://www.youtube.com/watch?v=vMfylGqu0_M,10 COOLEST Gadgets You Can ACTUALLY OWN,48994,823,23,Future Tech,603
210,https://www.youtube.com/watch?v=fmBuYaEB3pU,This Chinese Sodium Battery Will Change EV Industry FOREVER In 2023,820834,7349,654,Velocity,559
211,https://www.youtube.com/watch?v=0iZnTLyNac0,Linus Tech Tips Is In HUGE TROUBLE With These New Allegations - Possible CRIMINAL MISCONDUCT!,189436,6678,1385,Gamer Meld,398
212,https://www.youtube.com/watch?v=gcS6NWd5y7I,Chicken Hatchery Technology - Raising Broiler Farm - Modern Poultry Slaughter & Processing Plant,82703107,395244,8661,MachineArena,637
213,https://www.youtube.com/watch?v=-OAa9k0zCDg,What are you going to do in 2023? Tops 5 skills to get!,1859180,76278,2476,David Bombal,1135
214,https://www.youtube.com/watch?v=P5y3asAUpVQ,Top Tech Gadgets and Accessories Under Rs. 500 / 1000 / 1500,79178,2797,52,Top Tech,509
215,https://www.youtube.com/watch?v=DIZRdv3oEA0,Chris Level: Texas Tech's Strength Of This Team Is Its Lack of Weakness | Texas Tech Football,1224,56,26,365 Sports,816
216,https://www.youtube.com/watch?v=vMfylGqu0_M,10 COOLEST Gadgets You Can ACTUALLY OWN,48994,823,23,Future Tech,603
217,https://www.youtube.com/watch?v=wD6hyGXRcgk,TIMELAPSE OF FUTURE TECHNOLOGY: 2022 - 4000+,3973662,94393,15661,Venture City,1023
218,https://www.youtube.com/watch?v=kRzgCylePjk,Making A Billion-Year Lego Clock,3521412,104161,3825,Brick Technology,791
219,https://www.youtube.com/watch?v=_Kr73Fi8JAQ,Technology,93550,1510,6,Huda Hudia & DJ Fixx,430
220,https://www.youtube.com/watch?v=ljwCAJjcgRc,9 COOL Gadgets You Haven't Seen BEFORE,17364,399,7,Future Tech,528
221,https://www.youtube.com/watch?v=50Ti_sJwCnk,Bloomberg Technology 08/16/2023,8008,126,13,Bloomberg Technology,2661
222,https://www.youtube.com/watch?v=Ny1AsTKeQD8,"Diy tractor making Bulldozers | How to plant beans with high-tech machines | Pumpkin harvest ,Fruit",768163,2770,37,Farm Diorama,484
223,https://www.youtube.com/watch?v=Eik3Ydtf8dQ,'Bloomberg Technology' Full Show (04/06/2023),10976,160,54,Bloomberg Technology,2659
224,https://www.youtube.com/watch?v=C4cNnVK412U,"Some following up, and why I won't push you towards rooftop solar",252636,13542,3491,Technology Connextras,1828
225,https://www.youtube.com/watch?v=6-66RDslFuk,POPULAR TECH in LEGO...,4580506,73184,6127,TD BRICKS,509
226,https://www.youtube.com/watch?v=k0lcF4RR_2E,"See how these machines work, can't believe. Incredible technology modern machines",16356128,34035,3619,EzTech HD,842
227,https://www.youtube.com/watch?v=IErvIekMD3U,19 TOXIC Tech Fails that will last Forever.,14553846,350588,12488,Mrwhosetheboss,1754
228,https://www.youtube.com/watch?v=JsObuHO1tMA,Primitive Technology: Making Charcoal (3 Different Methods),1805115,82886,3518,Primitive Technology,915
229,https://www.youtube.com/watch?v=kZvE6ESK_wI,Automating 7 Lego Water Pumps,6971274,122484,2574,Brick Technology,551
230,https://www.youtube.com/watch?v=CTzSdnOyNbg,24 Aug एक और IPO | Tata Technologies IPO | IPO GMP | Jayesh Khatri,42007,1898,130,Knowledge Jazz,356
231,https://www.youtube.com/watch?v=YIgrOo1u3Tg,Kaatha - Technology Radio #020 (DJ-SET),1962,68,6,Technology Productions,3565
232,https://www.youtube.com/watch?v=7J52mDjZzto,Heat Pumps: the Future of Home Heating,3497849,96352,9851,Technology Connections,2115
233,https://www.youtube.com/watch?v=i4m098aRz9Q,20 Future Technologies That Will Change The World,94364,492,16,Future Unity,1857
234,https://www.youtube.com/watch?v=PI6VA8ZNL-0,We made a REAL HOLOGRAM Desk like Tony Stark's!,4342953,171674,3479,Hacksmith Industries,1437
235,https://www.youtube.com/watch?v=97yD1TBAU0c,"Reflowing random IC's, can be called a fix? The laptop screen technology, is changing! Lenovo 720s",20663,1515,126,Electronics Repair School,962
236,https://www.youtube.com/watch?v=N2EkakrZBSU,10 Coolest Gadgets to Buy on Amazon Right Now,25550,487,15,Future Tech,626
237,https://www.youtube.com/watch?v=BZWL7y2fNnE,Live Lessons for IELTS Speaking Practice: Topic of Technology PART 1,84561,2477,115,English Speaking Success,1040
238,https://www.youtube.com/watch?v=TMzo9zjkuHc,Primitive Technology: Rock-Throwing Catapult (Trebuchet),2698325,158214,12817,Primitive Technology,603
239,https://www.youtube.com/watch?v=rbkJa3wMW1E,Banks Collapsing | Bloomberg Technology 03/13/2023,29291,225,44,Bloomberg Technology,2658
240,https://www.youtube.com/watch?v=yJZXuo2SunE,20 Useful Google Tips & Trick You Must Know in 2020 !,5124183,294232,5839,Technology Gyan,774
241,https://www.youtube.com/watch?v=RzkD_rTEBYs,How will AI change the world?,1355840,39312,1644,TED-Ed,355
242,https://www.youtube.com/watch?v=kAm6dKvFb78,Tesla's technology to talk to spirits of the dead,1277360,76605,3514,The Why Files,741
243,https://www.youtube.com/watch?v=jWYcc8UYRIc,'Bloomberg Technology: SVB Fallout Special' (03/10/2023),126875,1011,195,Bloomberg Technology,2689
244,https://www.youtube.com/watch?v=FcAdu7TSKtA,Tech Bytes by nasscom Insights - August 2023 | Key Trends in Indian Technology Industry,7238,8,0,nasscom community & insights,879
245,https://www.youtube.com/watch?v=mfg4dGaKG8k,11 COOL Gadgets You Can BUY Right Now,43154,560,18,Future Tech,574
246,https://www.youtube.com/watch?v=zXFnJcpCFtk,The Ultimate High Tech Luxury Electric Car!,1547482,40242,2381,Auto Focus,1174
247,https://www.youtube.com/watch?v=DNN_Uya610o,Myvillage official videos EP 486 || Cooking technology of green vegetables,18587,489,296,Myvillage official,3684
248,https://www.youtube.com/watch?v=O-buiiyp_xU,Dope Tech: Better than Expected!,2826585,96509,2325,Marques Brownlee,848
249,https://www.youtube.com/watch?v=lqEChBkCsJU,9 INCREDIBLE Inventions 2023 | That Are NEXT LEVEL,27564,410,33,Future Tech,480
250,https://www.youtube.com/watch?v=rDOghts5QtM,INCREDIBLE CONSTRUCTION TECHNOLOGIES THAT ARE WORTH SEEING,3940179,20061,190,TechZone,682
251,https://www.youtube.com/watch?v=zIwLWfaAg-8,Elon Musk: The future we're building -- and boring | TED,25530333,383948,25297,TED,2450
252,https://www.youtube.com/watch?v=upoUDgC1tZU,"8 SECRET EXAM CHEATING GADGETS FOR STUDENTS | Gadgets under Rs100, Rs200 and Rs1000",5313539,71842,1389,Gadget Zone,449
253,https://www.youtube.com/watch?v=eesj3pJF3lA,Primitive Technology: Wood Ash Cement & Fired Brick Hut,10685533,279320,12014,Primitive Technology,793
254,https://www.youtube.com/watch?v=TswGy33B3yw,Sour Mood at Credit Suisse | Bloomberg Technology 03/20/2023,10461,162,33,Bloomberg Technology,2645
255,https://www.youtube.com/watch?v=DNN_Uya610o,Myvillage official videos EP 486 || Cooking technology of green vegetables,18587,489,296,Myvillage official,3684
256,https://www.youtube.com/watch?v=0mMbcKGO5_k,Sreenidhi Institute of Science & Technology - యూనివర్సిటీ పేరుతో శ్రీనిధి ఇంజనీరింగ్ కాలేజ్ దందా-TV9,9630,0,6,TV9 Telugu Live,283
257,https://www.youtube.com/watch?v=_oFR_ZayfSw,This Impossible Technology Just Turned Out to Be True Reality!,37142,844,51,Voyager,818
258,https://www.youtube.com/watch?v=RQE56ksVBB4,How Sodium-Ion Batteries May Challenge Lithium,674065,10553,819,CNBC,838
259,https://www.youtube.com/watch?v=oLt-X13CgQc,Cooling Our Homes Without Electricity?,1568119,38473,1756,Undecided with Matt Ferrell,913
260,https://www.youtube.com/watch?v=Hg_8-6-JZ9o,Linus Tech Tips VS Gamers Nexus ¿Qué pasó y qué se dijo? TERTULIA - DrogaDigital,11975,1088,311,DrogaDigital,2094
261,https://www.youtube.com/watch?v=uiUPD-z9DTg,The Next Global Superpower Isn't Who You Think | Ian Bremmer | TED,4199322,81429,7909,TED,898
262,https://www.youtube.com/watch?v=S_oKdEJm01Y,"Big chicken,cooking in clay pot recipes | Primitive technology",504135,4340,136,Primitive Wildlife.,879
263,https://www.youtube.com/watch?v=VS4yYHskzRs,"Scientists Discover New “Silicone Anode Battery” Technology Promises 2,000KM Range",2503,108,12,Velocity,691
264,https://www.youtube.com/watch?v=tQmFVcD-Mbo,Solar 3.0: This New Technology Could Change Everything,6017086,100736,4098,Electric Future,1040
265,https://www.youtube.com/watch?v=b-ohHsbPSrI,JOL TV: Georgia Tech names a QB for the Louisville game,782,78,4,Kelly Quinlan,2557
266,https://www.youtube.com/watch?v=g6LX8lHyfiU,Using AI to Decode the Fed | Bloomberg Technology 04/17/2023,9320,132,24,Bloomberg Technology,2665
267,https://www.youtube.com/watch?v=hDzLdLMCoos,"See how this cow machine works. Incredible farm, modern technology machines",27607390,65099,912,EzTech HD,700
268,https://www.youtube.com/watch?v=f2nRKHHCe84,INCREDIBLE Inventions That You Haven't Seen YET,13692,303,13,Future Tech,574
269,https://www.youtube.com/watch?v=Evb5Z9hNGM8,Why Apple Made NEW Yellow iPhone 14?,2498999,106167,2344,Tech Burner,486
270,https://www.youtube.com/watch?v=F1Sn7lJqaQM,Camping Inventions That Are the Next Level ▶8,596914,5538,74,Quantum Tech HD,629
271,https://www.youtube.com/watch?v=D8K90hX4PrE,Daft Punk - Technologic (Official Video),34386282,387766,27077,Daft Punk,176
272,https://www.youtube.com/watch?v=3NtUc30WsdU,20 Coolest Smart Home Gadgets of 2023,324013,2869,53,YouFact Tech,704
273,https://www.youtube.com/watch?v=gcRH-f3ytA4,Linus is Changing How We See Tech Content FOREVER.,58513,3516,794,Vex,1086
274,https://www.youtube.com/watch?v=xmVt8lC74ns,I go to ABSURD tech conference.,203123,10329,675,Programmers are also human,596
275,https://www.youtube.com/watch?v=rjvQ10fy6JI,सोफिया के साथ पहली मुलाकात | Tech Tak Special | Tech Tak,10890878,213995,5098,Fiiber Hindi,183
276,https://www.youtube.com/watch?v=HoLdoYmlCPo,No one is talking about the REAL issue - Gamers Nexus and Linus Tech Tips,223126,7324,2895,Coreteks,1104
277,https://www.youtube.com/watch?v=xCeAcDZhrwk,Technology essay in english for students,653721,9140,323,SAZ education,661
278,https://www.youtube.com/watch?v=nVXaSxeN4iw,Robots From CHINA are Taking Over The World. China's LARGEST Robot Exhibition - WRC 2022,2280916,10987,1611,Carros Show,758
279,https://www.youtube.com/watch?v=fKkVNY-T9uQ,Construction Of The World's Largest Airports In Türkiye. Leading Construction Equipment & Technology,787469,3110,79,YouCanDo TV,2151
280,https://www.youtube.com/watch?v=eqkbs5Z3y-M,( New ) Free internet 100% Working -  New Technology 2019,3774324,55245,2003,Energy Tech,617
281,https://www.youtube.com/watch?v=41lmPfh5Rgw,Amazing khakhra making Indian Technology #Technology,21517917,19781,428,Hetal's Art,617
282,https://www.youtube.com/watch?v=nGu0_8whK54,Linus Tech Tips has Problems,210356,10285,1304,Chris Titus Tech,740
283,https://www.youtube.com/watch?v=JMLsHI8aV0g,How China Is Using Artificial Intelligence in Classrooms | WSJ,3019493,67997,11892,Wall Street Journal,343
284,https://www.youtube.com/watch?v=V5QkDkIKpDM,The US Lethal Drone That No Enemy Is Prepared For,250037,8574,425,Dark Tech,591
285,https://www.youtube.com/watch?v=jh8QAn523bE,MODERN TECHNOLOGY BANANA FARM IN THE PHILIPPINES -AMAZING BANANA HARVESTING-GREAT BANANA PLANTATION,6175012,26618,780,Science & Technology UI,590
286,https://www.youtube.com/watch?v=kUhKShrHTYA,Real Invisibility Cloak Tech - 10 Amazing Invisibility Technologies,2292880,25734,1411,DailyTop10s,669
287,https://www.youtube.com/watch?v=4pu0zXlBn80,Most Satisfying Machines and Ingenious Tools ▶ 41,1834662,3797,102,Quantum Tech HD,592
288,https://www.youtube.com/watch?v=ZuF4YLJ3Gpw,Brain Drain and Capital Issues Plague India's Tech Industry || Peter Zeihan,403223,13583,2185,Zeihan on Geopolitics,284
289,https://www.youtube.com/watch?v=XQSJJ-n3Aw0,New Inventions That Are At Another Level ▶44,704138,5307,71,Quantum Tech HD,604
290,https://www.youtube.com/watch?v=_YDuLCIzbN4,Primitive Technology: Pottery and Stove,15899251,275104,15102,Primitive Technology,606
291,https://www.youtube.com/watch?v=6CWsLR5SuyU,What is Technology? - with some of its Advantages and Disadvantages to society,240643,2553,97,Laerac,209
292,https://www.youtube.com/watch?v=HoLdoYmlCPo,No one is talking about the REAL issue - Gamers Nexus and Linus Tech Tips,223126,7324,2895,Coreteks,1104
293,https://www.youtube.com/watch?v=OPIUMpiV0IY,Primitive Technology: Making Iron From Creek Sand,4532684,170189,7127,Primitive Technology,609
294,https://www.youtube.com/watch?v=JMLsHI8aV0g,How China Is Using Artificial Intelligence in Classrooms | WSJ,3019493,67997,11892,Wall Street Journal,343
295,https://www.youtube.com/watch?v=gcRH-f3ytA4,Linus is Changing How We See Tech Content FOREVER.,58513,3516,794,Vex,1086
296,https://www.youtube.com/watch?v=T53zdMvOPmE,Process of Making Ball Bearing with Modern Technology. Bearing Factory in Korea,12364162,61776,1989,Factory Monster,611
297,https://www.youtube.com/watch?v=eqkbs5Z3y-M,( New ) Free internet 100% Working -  New Technology 2019,3774324,55245,2003,Energy Tech,617
298,https://www.youtube.com/watch?v=Bewz73HXBRA,Friend.Tech ile Sosyal Token Satarak Para Kazanmak! - BEKLENEN VİDEO,3801,133,89,Tarık Bilen,596
299,https://www.youtube.com/watch?v=xmVt8lC74ns,I go to ABSURD tech conference.,203123,10330,675,Programmers are also human,596
300,https://www.youtube.com/watch?v=IcR0wO51_qI,"Cooking in jungle, meet the goat at waterfall | Primitive technology",3294487,25841,718,Primitive Wildlife.,805
301,https://www.youtube.com/watch?v=fKkVNY-T9uQ,Construction Of The World's Largest Airports In Türkiye. Leading Construction Equipment & Technology,787469,3110,79,YouCanDo TV,2151
302,https://www.youtube.com/watch?v=V5QkDkIKpDM,The US Lethal Drone That No Enemy Is Prepared For,250037,8574,425,Dark Tech,591
303,https://www.youtube.com/watch?v=EDsLYz9flL0,This Phone is New Flagship Killer Really?? - Moto Edge 40 Test,926863,36442,1986,Technology Gyan,536
304,https://www.youtube.com/watch?v=xfxEe-aq3hU,Essay on Technology in English // Write short essay on Technology in English || Handwriting,129293,1824,114,Technical Writer,603
305,https://www.youtube.com/watch?v=Jz4b3AJmZ5o,Cloud Seeding: The Secret to China & Dubai's Rain | Dhruv Rathee,3998316,171041,8400,Dhruv Rathee,1418
306,https://www.youtube.com/watch?v=4F0HOGj2cJ4,5 AMAZING *Useful Gadgets* UNDER ₹500 Rs ⚡️ TOP TECH 2022 - EP #32,5775667,170418,920,Aman Dhingra,534
307,https://www.youtube.com/watch?v=ZuF4YLJ3Gpw,Brain Drain and Capital Issues Plague India's Tech Industry || Peter Zeihan,403223,13583,2185,Zeihan on Geopolitics,284
308,https://www.youtube.com/watch?v=5EPGVRTmnyc,Modern Transportation Technology in the Future #4,7795398,25814,76,Human Technology,515
309,https://www.youtube.com/watch?v=aZApJcnukIw,Top 50 Smart Furniture & Ingenious Space Saving Designs | Best of Quantum Tech HD,1012548,7015,81,Quantum Tech HD,759
310,https://www.youtube.com/watch?v=t52Bi-ZUZjA,I Challenged My AI Clone to Replace Me for 24 Hours | WSJ,938167,14929,955,Wall Street Journal,454
311,https://www.youtube.com/watch?v=ZiXg6H_FycI,This TV gadget censors bad words with 1980's tech,1754973,78634,7325,Technology Connections,1467
312,https://www.youtube.com/watch?v=cc7ogUp3x-c,Linus Tech Tips Controversy,6207,375,50,Son of a Tech,1028
313,https://www.youtube.com/watch?v=97JZMrnRnYM,Modern Agriculture Machines That Are At Another Level ▶10,15281266,56788,1460,Quantum Tech HD,564
314,https://www.youtube.com/watch?v=759bYwbai8w,10 BANNED GADGETS YOU CAN STILL BUY ON AMAZON,1940456,10906,278,BEST COOL TECH,510
315,https://www.youtube.com/watch?v=_yMMTVVJI4c,Why don't Americans use electric kettles?,3100260,121251,27917,Technology Connections,1495
316,https://www.youtube.com/watch?v=aFPJf-wKTd0,How Hidden Technology Transformed Bowling,15014438,262925,9081,Veritasium,1680
317,https://www.youtube.com/watch?v=yi-h5hNzTVw,Why Apple is ending the iPhone in 2023,2684271,22116,7207,The Apple Circle,778
318,https://www.youtube.com/watch?v=SK9ROXIEgSU,Primitive Technology - Cooking 10 Red Fish For Food At The Forest,828430,10387,304,Primitive Wildlife.,774
319,https://www.youtube.com/watch?v=2_ipeD0shqg,Amazing World Modern Farming Egg Harvest Technology. Incredible Automatic Breeding Process Chicken,5659388,25266,212,Farm Machinery,489
320,https://www.youtube.com/watch?v=ckIka-WzGqg,Water Firing Hypercar with NASA Technology | Hyperion XP-1,9781,187,22,Supercar Gear,498
321,https://www.youtube.com/watch?v=kXL6DgUh4u8,Were the Unabomber’s Predictions About Technology Correct?,1122258,42332,5936,Moon,1257
322,https://www.youtube.com/watch?v=494TFnRVrz0,Turkish Aviation Festival: World's Largest Turkish Technology TEKNOFEST,5561,218,18,Tech Center,198
323,https://www.youtube.com/watch?v=Df1sbXrLVx4,खतरनाक Hacker बनना है तो ये जरूर सीखे 😲😲| Which Programming Languages Do HACKERS Use & Why ??,4045961,236885,6332,Technology Gyan,507
324,https://www.youtube.com/watch?v=ZifujZQqQMo,Apple Vision Pro first look,1000445,15339,1695,The Verge,272
325,https://www.youtube.com/watch?v=SS0mJU1iC88,Ai দিয়ে ভিডিও বানিয়ে লক্ষ টাকা ইনকাম | সত্য নাকি মিথ্যা!,229743,8189,468,AFR Technology,500
326,https://www.youtube.com/watch?v=JkEoKO5X9ZA,"Future Technology According to the Imagination #1 , #2",1216922,5613,25,Kin Kin Creativity,961
327,https://www.youtube.com/watch?v=D8K90hX4PrE,Daft Punk - Technologic (Official Video),34386282,387766,27077,Daft Punk,176
328,https://www.youtube.com/watch?v=SqB0lUcqFbA,Hating Apple is Getting REALLY Hard - WWDC 2023,3049937,102509,9849,Linus Tech Tips,589
329,https://www.youtube.com/watch?v=gTDQXoLmuUs,Amazing Technology Manufacturing Process of Rotavator Machine blade Mass Production Process Factory,634137,694,33,Random Skills,594
330,https://www.youtube.com/watch?v=kXL6DgUh4u8,Were the Unabomber’s Predictions About Technology Correct?,1122258,42332,5936,Moon,1257
331,https://www.youtube.com/watch?v=oIJAAL4Z-rg,Rescue 3 Puppies from Deep Hole Build Dog House From Brick And Fish Pond,6723867,32101,230,House Technology,1042
332,https://www.youtube.com/watch?v=Df1sbXrLVx4,खतरनाक Hacker बनना है तो ये जरूर सीखे 😲😲| Which Programming Languages Do HACKERS Use & Why ??,4045961,236885,6332,Technology Gyan,507
333,https://www.youtube.com/watch?v=yi-h5hNzTVw,Why Apple is ending the iPhone in 2023,2684271,22116,7207,The Apple Circle,778
334,https://www.youtube.com/watch?v=7FH2FfX39r4,"Intelligent Technology Smart Farming Automatic Cow Feeding, Modern Cow Milking Automatic Machine",5486111,14484,397,B Technology,603
335,https://www.youtube.com/watch?v=xkjMZvUILZM,Pro Guitar Tech's Most Hated Things (and how to fix them),459339,17969,1426,Rhett Shull,989
336,https://www.youtube.com/watch?v=494TFnRVrz0,Turkish Aviation Festival: World's Largest Turkish Technology TEKNOFEST,5561,218,18,Tech Center,198
337,https://www.youtube.com/watch?v=Dy8ogOaKk4Y,"Google, Facebook, Amazon - The rise of the mega-corporations | DW Documentary",3406645,29751,2407,DW Documentary,2546
338,https://www.youtube.com/watch?v=QT7NB3W8Qvo,Driving Lego Cars in Sand,8211422,135473,3914,Brick Technology,507
339,https://www.youtube.com/watch?v=gmTuI5LfgVc,Amazing Modern Automatic Cow Farming Technology - Incredible Automatic Feeding and Milking Machines,14677259,39735,593,Farm Machinery,524
340,https://www.youtube.com/watch?v=g8Qav3vIv9s,How are microchips made?,5221306,79267,1857,Interesting Engineering,335
341,https://www.youtube.com/watch?v=LpQxeGtZF2o,"Elon Musk Revealed All New Solar Panels for 2024 Renewable Energy, Can blow your mind!",1011749,9108,466,TESLA CAR WORLD,1787
342,https://www.youtube.com/watch?v=9irICRnszOc,Primitive Technology: Iron Bacteria Cement (no fire/water insoluble),1819500,82741,2596,Primitive Technology,336
343,https://www.youtube.com/watch?v=csYmsSG1_pc,"Making & Documenting Software Architecture Decisions: Technology Radars, Technology Standards, ADRs",16,0,0,Erik Wilde,1481
344,https://www.youtube.com/watch?v=Gqhxe_pL6Ws,Primitive Technology: Pottery Wheel,2258954,95457,3590,Primitive Technology,561
345,https://www.youtube.com/watch?v=qPn0NsZDtkk,"Hoysaleswara Temple, India - Built with Ancient Machining Technology?",2680511,56525,7193,PraveenMohan,535
346,https://www.youtube.com/watch?v=DuAeaIcAXtg,There are two types of smoke alarm. One of 'em ain't so good.,1744409,78928,9032,Technology Connections,1495
347,https://www.youtube.com/watch?v=QzJ1ywtxmz8,Joe Rogan: Archeologists Are LYING About ANCIENT Technology Used,2873666,42044,7482,JRE Shorts,462
348,https://www.youtube.com/watch?v=bZmliw7SsNI,Camping Inventions That Are the Next Level ▶6,1786076,13313,154,Quantum Tech HD,600
349,https://www.youtube.com/watch?v=4RixMPF4xis,AI vs Machine Learning,413970,14833,367,IBM Technology,349
350,https://www.youtube.com/watch?v=pntmglWQVUQ,"Turtle, cooking eating delicious | Primitive technology",1229305,10484,427,Primitive Wildlife.,734
351,https://www.youtube.com/watch?v=l9rnSvlzOD0,DESTROYING FRANKLIN’S HOUSE IN MINECRAFT,22239622,1069031,44401,Techno Gamerz,1180
352,https://www.youtube.com/watch?v=nBHQ9nV0Vbw,"Amazing Woodworking Factory | Extreme Wood Cutting Sawmill Machines, Cheesy Wood Giant 1000 Year Old",4790110,15028,396,Woodworking Technology,1404
353,https://www.youtube.com/watch?v=r_nvkq5gpOQ,How to Use and Make Money on Friend Tech (Airdrop Guide!),4420,86,57,Dynamo DeFi,631
354,https://www.youtube.com/watch?v=8TQcT3bma9g,Future Technology According to the Imagination | Virus Collection | #46 (P25),4723578,23800,128,Kin Kin GT,509
355,https://www.youtube.com/watch?v=SC4JxhrBtUM,How To Make Helicopter Matchbox Helicopter Toy Diy,124670096,339420,12369,Satish Tech,176
356,https://www.youtube.com/watch?v=upibtnUrDUE,"The Texas Tech horse is so dark it's ""glowing""",2462,115,26,Locked On Texas Tech,1798
357,https://www.youtube.com/watch?v=Blf46HbbFXU,12 Most Incredible Transport Technologies Of The Future,33353,504,18,Lightning Top,928
358,https://www.youtube.com/watch?v=frmFGo5cpWQ,Information Science and Technology at George Mason University | INTO,228,4,0,INTO Study,211
359,https://www.youtube.com/watch?v=z3ZObFDhY78,Cardiac Technology Vs Cardiac Perfusion எது சிறந்தது?|@successtosuccess1457,1670,0,9,Success To Success,329
360,https://www.youtube.com/watch?v=lo6D67MY4J4,Mobile Healthcare Apps: How Mobile Technology in Healthcare is Transforming the Industry,18416,108,8,QBurst,160
