Index,Video Url,Video Title,Video Views,Video Likes,Video Comments,Video Author,Duration In Seconds
361,https://www.youtube.com/watch?v=xRfkXXUyiYY,Unmasking a Killer's Memory: Can New Technology Read Murderer's Mind? | New Detectives | Real Crime,18804,532,41,Real Crime,3126
362,https://www.youtube.com/watch?v=7KCGrxFtqlI,Borschtsch - Amerikanski Technology,72364,1487,65,valk82,351
363,https://www.youtube.com/watch?v=LICUFidBF_c,আর্টিফিশিয়াল ইন্টিলিজেন্সের কিছু ভয়ংকর রূপ | Use of Artificial Intelligence,148918,3932,218,AFR Technology,249
364,https://www.youtube.com/watch?v=IS3e2nxiW8I,Automatic Camel Milking Technology - Modern Camel Farming -  Amazing Camel Milk Product,8628887,34433,668,Noal Farm,556
365,https://www.youtube.com/watch?v=rCgUmKVeTRw,How Technology Can Enable Sustainable Procurement,29,6,0,SupplyChainBrain,512
366,https://www.youtube.com/watch?v=sgJ4LhFYjjM,Audi's New Lighting Technology | A6 Avant e-Tron,6496906,55252,3791,Supercar Blondie,483
367,https://www.youtube.com/watch?v=Vt8ErEcu618,"China's laser weapon technology, Ukraine's demining machine and more | TIO: ​Ep 124 | Full Show",3002,37,5,WION,1379
368,https://www.youtube.com/watch?v=ODHO9cloTQs,Open-Source Technology for Big Data Analytics,472,6,0,Sirisha Lectures,384
369,https://www.youtube.com/watch?v=k2RKtUh6m3Q,Primitive Technology: Purifying Clay By Sedimentation and Making Pots,3226946,127956,4311,Primitive Technology,652
370,https://www.youtube.com/watch?v=P-QXhwKRg8U,Amazing Tools That Are On Another Level ▶ 43,2510880,9940,118,Quantum Tech HD,562
371,https://www.youtube.com/watch?v=82Rsuqalnbc,Vision Technologies | The Leading Sports Manufacturer From Pakistan,6007,75,0,Vision Technologies,284
372,https://www.youtube.com/watch?v=I-ORt8313Og,Cyberpunk 2077 Ray Tracing: Overdrive Technology Preview on RTX 4090,727077,25030,4200,Digital Foundry,651
373,https://www.youtube.com/watch?v=GODSmXQC8nI,B.Tech in Agriculture Information Engineering - Eligibility | Career Scope | Job Opportunities,2411,46,7,Agriculture and Technology,335
374,https://www.youtube.com/watch?v=6yCl6NYKZr0,Enzyme Technology MCQ | Unit 7 III | 4th Semester  | BSc 2nd Year Zoology,3074,65,4,School of Biology,606
375,https://www.youtube.com/watch?v=MoQtjYQ8BKs,Waterbodies | CID | Technology Designed For Tourists Becomes A Weapon | 10 Feb 2023,4375187,33309,320,LIV Crime,2791
376,https://www.youtube.com/watch?v=s0JAzqNxmeQ,8 MINUTES AGO: China LAUNCHED Its Artificial Sun And Proves It's TECHNOLOGICAL POWER!,791761,5955,159,Future Unity,574
377,https://www.youtube.com/watch?v=FNXB5qeDe6s,"Karlsruhe Institute of Technology, Germany | Campus | Ranking | Courses | Fees | EasyShiksha.com",4106,42,6,EasyShiksha TV,318
378,https://www.youtube.com/watch?v=6zA_cuEP378,15.4CH Definitive Technology + Denon Awesome Demo Experience!,19930,400,31,Audioholics,391
379,https://www.youtube.com/watch?v=JkeX_DBIVgQ,25 Amazing Gadgets & Home Appliances from Amazon ▶3,5553302,18613,200,Quantum Tech HD,340
380,https://www.youtube.com/watch?v=_ok5n7GrTIo,New Inventions That Are At Another Level ▶41,6223871,19954,288,Quantum Tech HD,570
381,https://www.youtube.com/watch?v=YDcakKDJWv0,Amazing Farming ideas for Your Home & Garden,13466036,72181,1696,Smart Garden Technology,401
382,https://www.youtube.com/watch?v=IZGJ2Nz9B5M,पुरानी Spring से बनाया Free का Indian जुगाड़ ₹1000 बचाये || Top New Idea,3987878,47062,834,Samar Experiment,416
383,https://www.youtube.com/watch?v=QE4zOJqe4eQ,Teens React To Palm Pilots | Reacting to Old Technology | REACT,171132,3962,1018,REACT,595
384,https://www.youtube.com/watch?v=ZMT38JDc0yA,23nd Century Future Technology VFX - Hulk vs Iron Man War in Future World,4765060,34613,154,Comosix Tech,1326
385,https://www.youtube.com/watch?v=CU38gUD1GBA,Joe Rogan Just Announced The TERRIFYING Truth About Antarctica,4947316,61035,172,Future Unity,1360
386,https://www.youtube.com/watch?v=jgs4DGMrhTs,The Technology of The Antichrist,44139,726,36,Bass Coast Baptist Church,4497
387,https://www.youtube.com/watch?v=wJBAxnQBtec,SBI Technology Opportunities Fund | SBI Technology Opportunities Fund Direct Growth 2023,4269,82,1,AD Guide Official,602
388,https://www.youtube.com/watch?v=9hD3H3fXceg,Stem Cell Technology - Science and Technology for UPSC (Episode 4),50021,1584,69,Let's Crack UPSC CSE,1245
389,https://www.youtube.com/watch?v=d1XlvHZMfuE,Technology Can Be Used As An Enabler,307,12,15,Business Today,238
390,https://www.youtube.com/watch?v=I2Hua4A0_Ow,"Information technology branch analysis . Jobs, salary, colleges..",63731,1952,165,Diploma Trends,550
391,https://www.youtube.com/watch?v=7CH6BURyXRg,Hical Technologies video - May 2022,2534,84,0,Hical Technologies Pvt. Ltd,145
392,https://www.youtube.com/watch?v=DLWfVZw4PSQ,Bloomberg Technology 08/17/2023,2771,29,2,Bloomberg Television,2665
